Article Title,Article Description,Article Author,Article Link,Article Image
PENDING SALES FALL 1% IN JULY,"Pending home sales declined for the second consecutive month in July and for the eighth time in the last nine months, according to the National Association of Realtors (NAR). After a decline of 8.6% in June, the Pending Home Sales Index (PHSI), a forward-looking indicator of home sales based on contract signings, decreased 1% to 89.8 in July. On a year-over-year (YOY) basis, pending transactions are down 19.9%. According to the NAR, an index reading of 100 is equal to the level of contract activity in 2001.",Vincent Salandro,https://www.builderonline.com/data-analysis/pending-sales-fall-1-in-july_o,https://cdnassets.hw.net/dims4/GG/98e9d7f/2147483647/resize/300x%3E/quality/90/?url=https%3A%2F%2Fcdnassets.hw.net%2F79%2Fde%2F40fc85fc45f79232b0a071b5eac2%2Fscreen-shot-2019-01-02-at-9.29.06%20AM.png
NEW-HOME SALES DROP 12.6% IN JULY,"Sales of new single‐family houses in July were at a seasonally adjusted annual rate of 511,000, according to estimates released by the U.S. Census Bureau and the Department of Housing and Urban Development. This is 12.6% below the revised June rate of 585,000 and 29.6% below the July 2021 estimate of 726,000.",Symone Strong,https://www.builderonline.com/data-analysis/new-home-sales-drop-12-6-in-july_o,https://cdnassets.hw.net/dims4/GG/bf091f2/2147483647/resize/876x%3E/quality/90/?url=https%3A%2F%2Fcdnassets.hw.net%2F0b%2Ffa%2F2cc0dd6a4205bd00d41ea206d6c9%2Fadobestock-264343706.jpeg
CONSTRUCTION EMPLOYMENT TRAILS PRE-PANDEMIC LEVELS IN 15 STATES,"Construction employment trailed pre-pandemic levels in 15 states in July, according to analysis of federal employment data released by the Associated General Contractors of America (AGC).",BUILDER Staff,https://www.builderonline.com/data-analysis/construction-employment-trails-pre-pandemic-levels-in-15-states_o,https://cdnassets.hw.net/dims4/GG/349d21d/2147483647/resize/300x%3E/quality/90/?url=https%3A%2F%2Fcdnassets.hw.net%2F30%2F30%2F37f55e7441cd9021a678c7010268%2Fadobestock-179280204.jpeg
5 HOUSING MARKETS THAT ARE HOLDING UP IN THE SLOWDOWN,"The cooling market is causing sales prices to drop, incentives to be offered, and unsold inventory to stack up throughout the U.S. While some markets are faring better than others, these five are holding up well to the shift, according to Zonda market reports and unsold inventory levels.",Leah Draffen,https://www.builderonline.com/data-analysis/5-housing-markets-that-are-holding-up-in-the-slowdown_o,https://cdnassets.hw.net/dims4/GG/8cbf97d/2147483647/resize/876x%3E/quality/90/?url=https%3A%2F%2Fcdnassets.hw.net%2F02%2F7c%2Fdc21be7646529d271c3d4b7d3bfe%2Fadobestock-88099712.jpeg
NEW HOMES TRENDING SMALLER SINCE PEAK OF PANDEMIC,"During the height of the pandemic, residential space was in high demand, and, subsequently, the sizes of new single-family homes increased to accommodate shifting preferences. However, according to the NAHB, as the housing market is softening, the trend toward larger new single-family homes appears to be reversing.",No Author name,https://www.builderonline.com/data-analysis/new-homes-trending-smaller-since-peak-of-pandemic_c,None
SINGLE-FAMILY HOUSING DEMAND WILL REMAIN 'SOLID' FOR THE NEXT DECADE,"There has been no shortage of negative headlines recently about the housing market, many of them alluding to the industry's ""collapse"" or ""crash."" And while yes, ""housing is already in the midst of a downturn,"" according to NAHB's assistant vice president of forecasting and analysis Danushka Nanayakkara-Skillington, she also is sure to point out that the association expects housing to lead the economic recovery in 2024. ""We forecast over a million single-family starts and 510,000 multifamily starts in 2024.""",Jennifer Lash,https://www.builderonline.com/data-analysis/single-family-housing-demand-will-remain-solid-for-the-next-decade_o,https://cdnassets.hw.net/dims4/GG/01545a0/2147483647/resize/876x%3E/quality/90/?url=https%3A%2F%2Fcdnassets.hw.net%2Fdb%2F2c%2F3bcf960f4654b161d8a73a548488%2Fadobestock-850971.jpeg
BUILD-TO-RENT CONSTRUCTION INCREASES SIGNIFICANTLY ON YOY BASIS,"Single-family build-to-rent construction “surged” during the second quarter as overall affordability suffered from higher mortgage interest rates, according to an NAHB analysis of the Census Bureau’s Quarterly Starts and Completions by Purpose and Design. The 21,000 build-to-rent starts during the second quarter represented a 91% year-over-year gain compared with 2021.",No Author name,https://www.builderonline.com/data-analysis/build-to-rent-construction-increases-significantly-on-yoy-basis_c,None
HOUSING MARKET CONTINUES TO COOL IN JULY,"July marked another cooler month for the housing market, according to Zonda’s newly expanded New Home Market Update report.",Symone Strong,https://www.builderonline.com/data-analysis/housing-market-continues-to-cool-in-july_o,https://cdnassets.hw.net/dims4/GG/51c0416/2147483647/resize/876x%3E/quality/90/?url=https%3A%2F%2Fcdnassets.hw.net%2Ffe%2Fe8%2F253fdeda4785b8130e8c4ffb4c83%2Fadobestock-123091886.jpeg
EXISTING-HOME SALES DECLINE FOR SIXTH CONSECUTIVE MONTH IN JULY,"Total existing-home sales, which includes sales of single-family homes, townhomes, condominiums, and co-ops, decreased for the sixth consecutive month in July, according to the National Association of Realtors (NAR). Sales fell 5.9% from June to a seasonally adjusted annual rate of 4.81 million in July. On a year-over-year basis, sales fell 20.2% in July.",Vincent Salandro,https://www.builderonline.com/data-analysis/existing-home-sales-decline-for-sixth-consecutive-month-in-july_o,https://cdnassets.hw.net/dims4/GG/9baf82a/2147483647/resize/300x%3E/quality/90/?url=https%3A%2F%2Fcdnassets.hw.net%2F2a%2F0b%2Faa18bb4c469f9a2b0ea9c3f0e782%2Fadobestock-64479058.jpeg
"FITCH RATINGS: HOUSING DOWNTURN POSSIBLE, BUT NOT YET",Fitch Ratings has released a special report based on macroeconomic headwinds and current softening housing fundamentals. The rating case scenario reveals a more moderate pullback as a severe downtown in U.S. housing has increased but is not yet probable. Mid-single-digit declines in 2023 and 2024 would further the possibility especially as the affordability crisis increases.,Leah Draffen,https://www.builderonline.com/data-analysis/fitch-ratings-housing-downturn-possible-but-not-yet_o,https://cdnassets.hw.net/dims4/GG/34a0e59/2147483647/resize/300x%3E/quality/90/?url=https%3A%2F%2Fcdnassets.hw.net%2F29%2F17%2F5a87a3834412946a7385de95fba0%2Fadobestock-264613473.jpeg
SINGLE-FAMILY STARTS DECLINE 10.1% IN JULY,"Privately owned housing starts were at a seasonally adjusted annual rate of 1,446,000 in July, 9.6% below the revised June estimate of 1,599,000 and 8.1% below the July 2021 rate, according to the U.S. Census Bureau and the Department of Housing and Urban Development (HUD).",Vincent Salandro,https://www.builderonline.com/data-analysis/single-family-starts-decline-10-1-in-july_o,https://cdnassets.hw.net/dims4/GG/e466e29/2147483647/resize/300x%3E/quality/90/?url=https%3A%2F%2Fcdnassets.hw.net%2Fc7%2Fe0%2F0fee96c34e129e679ecdb8416c91%2Fadobestock-245285592.jpeg
LUMBER PRICE GROWTH MODERATES IN JULY,"Prices for building materials have increased 35.7% since January 2020, with approximately 80% of the increase occurring since January 2021. Despite the strong increases since 2020 and 2021, building material prices rose only marginally, by 0.4%, in July, according to the Producer Price Index (PPI) from the Bureau of Labor Statistics. Prices for softwood lumber increased marginally year over year in July, while the prices for concrete products experienced their largest year-to-date increase in the history of the PPI, according to the NAHB.",No Author name,https://www.builderonline.com/data-analysis/lumber-price-growth-moderates-in-july_c,None
NAHB/WELLS FARGO HOUSING MARKET INDEX DROPS TO LOWEST LEVEL SINCE MAY 2020,"Builder confidence fell for the eighth consecutive month in August as elevated interest rates, supply chain problems, and high home prices continued to exacerbate housing affordability challenges, according to the NAHB.",Vincent Salandro,https://www.builderonline.com/data-analysis/nahb-wells-fargo-housing-market-index-drops-to-lowest-level-since-may-2020_o,https://cdnassets.hw.net/dims4/GG/39de89f/2147483647/resize/300x%3E/quality/90/?url=https%3A%2F%2Fcdnassets.hw.net%2F37%2Fa3%2Fe140777e4b0e9347e82897c5711a%2Fhouses-graph-falling.jpg
SUN BELT OFFERS PRIME 'BABY CHASER' LOCALES,"We can learn a lot about a local housing market by understanding demographics and how the trends are shifting. Millennials are now the largest home buying cohort in the United States, and where millennials go, baby boomers often follow. This migration pattern is partly because 25% of baby boomers plan to retire to a location near their children and grandchildren, Zonda research shows.",Ali Wolf,https://www.builderonline.com/data-analysis/sun-belt-offers-prime-baby-chaser-locales_o,https://cdnassets.hw.net/dims4/GG/5f14a71/2147483647/resize/876x%3E/quality/90/?url=https%3A%2F%2Fcdnassets.hw.net%2F87%2F29%2F9506d7814fcfa8d1b354006730fa%2Fadobestock-171684606.jpeg
80% OF METROS SAW DOUBLE-DIGIT PRICE GAINS IN Q2 2022,"Despite rising mortgage rates and slumping home sales in 2022’s second quarter, a greater number of markets experienced double-digit annual price gains compared with the prior quarter, according to the latest quarterly report from the National Association of Realtors (NAR).",Symone Strong,https://www.builderonline.com/data-analysis/80-of-metros-saw-double-digit-price-gains-in-q2-2022_o,https://cdnassets.hw.net/dims4/GG/e6a2a9c/2147483647/resize/876x%3E/quality/90/?url=https%3A%2F%2Fcdnassets.hw.net%2F2e%2Faa%2Fc2a20af64f0db3723e6556ab917b%2Fadobestock-295330529.jpeg
NEW HOME LOT INVENTORY REMAINS TIGHT IN SECOND QUARTER,"Zonda’s New Home Lot Supply Index (LSI) fell 9.3% year over year to a reading of 38 in the second quarter of 2022. On a quarter-over-quarter basis, supply decreased by 2.2%, down slightly from the first quarter of the year.",Symone Strong,https://www.builderonline.com/data-analysis/new-home-lot-inventory-remains-tight-in-second-quarter_o,https://cdnassets.hw.net/dims4/GG/00c63b6/2147483647/resize/876x%3E/quality/90/?url=https%3A%2F%2Fcdnassets.hw.net%2F31%2F51%2Fbcd14a0041108e6cca9b9b283a2c%2Fadobestock-231258733.jpeg
NAHB: SINGLE-FAMILY HOME STARTS IN 2021 GREW AT FASTEST PACE IN EIGHT YEARS,"According to an NAHB analysis of the Survey of Construction, new single-family starts were 14% higher in 2021 than in 2020, the fastest growth rate since 2013. The 1.1 million single-family units started in 2021 marked the highest count of starts since the Great Recession, according to the NAHB.",No Author name,https://www.builderonline.com/data-analysis/nahb-single-family-home-starts-in-2021-grew-at-fastest-pace-in-eight-years_c,None
CONSUMER SENTIMENT TOWARD HOUSING REACHES LOWEST LEVEL SINCE 2011,"Consumer sentiment toward housing decreased to its lowest level since 2011 in July, according to the Fannie Mae Home Purchase Sentiment Index (HPSI). The HPSI dropped 2 points on a month-over-month basis to a reading of 62.8 last month.",Vincent Salandro,https://www.builderonline.com/data-analysis/consumer-sentiment-toward-housing-reaches-lowest-level-since-2011_o,https://cdnassets.hw.net/dims4/GG/5932315/2147483647/resize/300x%3E/quality/90/?url=https%3A%2F%2Fcdnassets.hw.net%2Fa6%2Fbf%2Fd916d7754b1785dccac6d4510721%2Fscreen-shot-2018-10-23-at-4.24.38%20PM.png
"NONFARM PAYROLL EMPLOYMENT REACHES PRE-PANDEMIC, FEBRUARY 2020 LEVELS IN JULY","Total nonfarm payroll employment rose by 528,000 in July, an increase from the 390,000 jobs added in June, according to the latest jobs report from the U.S. Bureau of Labor Statistics (BLS). The unemployment rate edged down from 3.6% in June to 3.5% in July.",Vincent Salandro,https://www.builderonline.com/data-analysis/nonfarm-payroll-employment-reaches-pre-pandemic-february-2020-levels-in-july_o,https://cdnassets.hw.net/dims4/GG/69b424d/2147483647/resize/300x%3E/quality/90/?url=https%3A%2F%2Fcdnassets.hw.net%2F30%2F04%2Ff94037ba47149b83fb8cf9b60bb1%2Fgraph-upwards.jpg
MORE PROSPECTIVE BUYERS ARE ACTIVELY SEARCHING FOR HOMES,"The share of prospective home buyers actively engaged in the home buying process increased to 49% in the second quarter of 2022, the first increase in three quarters, according to the NAHB. The association suggests the pivot is driven by less competition from buyers who have exited the market, which may have encouraged some prospective buyers to become active buyers.",No Author name,https://www.builderonline.com/data-analysis/more-prospective-buyers-are-actively-searching-for-homes_c,None
PRIVATE RESIDENTIAL SPENDING DECLINES IN JUNE,"Private residential construction spending decreased 1.6% in June, according to NAHB’s analysis of the Census Construction Spending data. The month-over-month decline was the first decrease since May 2020, though private construction spending was 15.6% higher on a year-over-year basis.",No Author name,https://www.builderonline.com/data-analysis/private-residential-spending-declines-in-june_c,None
YARDI MATRIX REPORTS INSTITUTIONAL INVESTMENT IN SINGLE-FAMILY RENTALS IS RISING,"According to Yardi Matrix’s new bulletin, institutional investment in single-family rental (SFR) homes is on the rise and is expected to grow drastically over the next eight years. For 2021, Yardi Matrix shares that institutional acquisitions of SFRs in communities of 50 or more units skyrocketed to $2.5 billion. Yet, investors are now having to look at the most effective strategies for growing portfolios as interest rates increase.",Leah Draffen,https://www.builderonline.com/data-analysis/yardi-matrix-reports-institutional-investment-in-single-family-rentals-is-rising_o,https://cdnassets.hw.net/dims4/GG/9d929c7/2147483647/resize/876x%3E/quality/90/?url=https%3A%2F%2Fcdnassets.hw.net%2Fa0%2Ffc%2Ff465936948b9bf7b380c0431a26a%2Fadobestock-107074954.jpeg
HOUSING MARKET SLOWS AS FED TAKES AGGRESSIVE APPROACH TO COMBAT INFLATION,"As inflation continues to persist at 40-year highs and the Federal Reserve continues to take an aggressive approach to rein in inflation, the housing market—already at its own inflection point due to slowing sales and increasing cancellations and incentives—is likely to slow. Since housing is an interest-rate sensitive industry, efforts from the Federal Reserve to increase the federal funds rate to tame inflation will have an impact on mortgage rates, affordability, and consumer confidence in the housing sector. On Zonda’s National Housing Market Update webinar, chief economist Ali Wolf says “there’s an argument to be made” that many parts of the country have softened and weakened in response to the ongoing economic conditions.",Vincent Salandro,https://www.builderonline.com/data-analysis/housing-market-slows-as-fed-takes-aggressive-approach-to-combat-inflation_o,https://cdnassets.hw.net/dims4/GG/87470b8/2147483647/resize/300x%3E/quality/90/?url=https%3A%2F%2Fcdnassets.hw.net%2Fc2%2F39%2F8039ce674fabae1714e5af3b6d64%2Fhouse-falling-through-cracks.jpg
PENDING HOME SALES DECLINE 8.6% IN JUNE,"Pending home sales decreased in June 8.6% on a month-over-month basis to an index reading of 91.0, according to the National Association of Realtors (NAR). On a year-over-year basis, the Pending Home Sales Index (PHSI) decreased 20%. An index of 100 is equal to the level of contract activity in 2001.",Vincent Salandro,https://www.builderonline.com/data-analysis/pending-home-sales-decline-8-6-in-june_o,https://cdnassets.hw.net/dims4/GG/247072f/2147483647/resize/300x%3E/quality/90/?url=https%3A%2F%2Fcdnassets.hw.net%2Ff6%2Fd6%2Fcf1670fb4350826f1345070fc732%2Ffor-sale-sign.jpeg
NEW-HOME SALES TUMBLE IN JUNE,"Sales of new single‐family houses in June were at a seasonally adjusted annual rate of 590,000, according to estimates released by the U.S. Census Bureau and the Department of Housing and Urban Development. This is 8.1% below the revised May rate of 642,000 and 17.4% below the June 2021 estimate of 714,000.",Symone Strong,https://www.builderonline.com/data-analysis/new-home-sales-tumble-in-june_o,https://cdnassets.hw.net/dims4/GG/66fc12b/2147483647/resize/876x%3E/quality/90/?url=https%3A%2F%2Fcdnassets.hw.net%2Fc7%2Fe0%2F0fee96c34e129e679ecdb8416c91%2Fadobestock-245285592.jpeg
CASE-SHILLER INDEX POSTS 19.7% ANNUAL HOME PRICE GAIN IN MAY,"The S&P CoreLogic CaseShiller U.S. National Home Price NSA Index, which covers all nine U.S. census divisions, reported a 19.7% annual gain in May, down from 20.6% in the previous month. The 10-City and 20-City Composites both posted year-over-year gains slightly lower than April levels, at 19% and 20.5%, respectively.",Vincent Salandro,https://www.builderonline.com/data-analysis/case-shiller-index-posts-19-7-annual-home-price-gain-in-may_o,https://cdnassets.hw.net/dims4/GG/597cf17/2147483647/resize/300x%3E/quality/90/?url=https%3A%2F%2Fcdnassets.hw.net%2Fb8%2F58%2Fc51d0e254edd944cfc1cec8594d2%2Fadobestock-269041612.jpeg
MORTGAGE APPLICATIONS FOR NEW HOMES DECREASE 12% IN JUNE,"Mortgage applications for new-home purchases in June decreased 12% compared with a year ago, according to the latest Mortgage Bankers Association (MBA) Builder Application Survey (BAS). Compared with May, applications decreased by 10%.",Symone Strong,https://www.builderonline.com/data-analysis/mortgage-applications-for-new-homes-decrease-12-in-june_o,https://cdnassets.hw.net/dims4/GG/78d1468/2147483647/resize/876x%3E/quality/90/?url=https%3A%2F%2Fcdnassets.hw.net%2F11%2F82%2Ff2bf8e6e4c8b878cfc8ddc568e3f%2Fproxy-90.jpg
SHARE OF WOOD-FRAMED HOMES INCREASED IN 2021,"Wood framing remains the most common construction method for single-family homes in the U.S. per the 2021 data, despite roller coaster lumber prices and ongoing supply-chain issues. According to NAHB analysis of 2021 Census Bureau data, 92% of new homes were wood-framed, another 7% were concrete-framed homes, and less than half a percent was steel-framed.",No Author name,https://www.builderonline.com/data-analysis/share-of-wood-framed-homes-increased-in-2021_c,None
AIA: DEMAND FOR NONRESIDENTIAL SERVICES REMAINS STRONG IN JUNE BILLINGS,"AIA’s monthly Architecture Billings Index lowered a bit in June, decreasing 0.3 point from May's score of 53.5. The ABI is a leading economic indicator of construction activity in the U.S. and reflects a nine- to 12-month lead time between architecture billings and construction spending nationally, regionally, and by project type. A score above 50 represents an increase in billings from the previous month, while a score below 50 represents a contraction.",ARCHITECT Staff,https://www.builderonline.com/data-analysis/aia-demand-for-nonresidential-services-remains-strong-in-june-billings_s,None
SURVEY REVEALS TOP FRUSTRATIONS AND CONFRONTATIONS AMONG NEIGHBORS,"Whether they share a wall, a fence, or live across the street, a new nationwide survey by Lombardo Homes—No. 95 on the 2022 Builder 100—found more than half of Americans (53%) currently have an annoying neighbor.",Symone Strong,https://www.builderonline.com/data-analysis/survey-reveals-top-frustrations-and-confrontations-among-neighbors_o,https://cdnassets.hw.net/dims4/GG/e57446d/2147483647/resize/876x%3E/quality/90/?url=https%3A%2F%2Fcdnassets.hw.net%2F42%2Fcd%2Fb5de96174eee99b9215112489d83%2Fadobestock-259715800.jpeg
NEW HOME PENDING SALES INDEX DECREASES 7.5% ON YEAR-OVER-YEAR BASIS IN JUNE,"Zonda’s New Home Pending Sales Index (PSI) fell month over month for the fifth consecutive month to a reading of 125.5 in June. The June 2022 index reading represented a 7.5% decrease compared with June 2021 and, overall, the PSI is 27.9% below cycle highs, according to Zonda.",Vincent Salandro,https://www.builderonline.com/data-analysis/new-home-pending-sales-index-decreases-7-5-on-year-over-year-basis-in-june_o,https://cdnassets.hw.net/dims4/GG/630ca1a/2147483647/resize/300x%3E/quality/90/?url=https%3A%2F%2Fcdnassets.hw.net%2F2b%2F84%2F29c9128b497e92485d456d404358%2Fadobestock-242445011.jpeg
NKBA’S RESIDENTIAL KITCHEN AND BATH MARKET OUTLOOK UPDATE FORECASTS DOUBLE-DIGIT INCREASE OVER 2021,"The National Kitchen & Bath Association (NKBA) has released its July 2022 Kitchen & Bath Market Outlook. As the world’s leading association for the kitchen and bath industry, NKBA’s overall annual forecast still reveals a double-digit increase over 2021.",Leah Draffen,https://www.builderonline.com/data-analysis/nkbas-residential-kitchen-and-bath-market-outlook-update-forecasts-double-digit-increase-over-2021_o,https://cdnassets.hw.net/dims4/GG/3b123b6/2147483647/resize/876x%3E/quality/90/?url=https%3A%2F%2Fcdnassets.hw.net%2F7a%2Fc9%2Fc3d113e4450488ebee9e5b3f9cad%2Fadobestock-241969310-kitchen.jpeg
EXISTING-HOME SALES SLIDE FOR FIFTH CONSECUTIVE MONTH IN JUNE,"Existing-home sales declined for the fifth consecutive month in June to a seasonally adjusted rate of 5.12 million, according to the National Association of Realtors (NAR). Existing-home sales, which includes sales of single-family homes, townhomes, condominiums, and co-ops, decreased 5.4% from May and decreased 14.2% on a year-over-year (YOY) basis in June.",Vincent Salandro,https://www.builderonline.com/data-analysis/existing-home-sales-slide-for-fifth-consecutive-month-in-june_o,https://cdnassets.hw.net/dims4/GG/0b4e861/2147483647/resize/300x%3E/quality/90/?url=https%3A%2F%2Fcdnassets.hw.net%2F2a%2F85%2Fa86d1ed14452969e139bf7c46495%2Fadobestock-71297088.jpeg
RESIDENTIAL CONSTRUCTION STARTS DECLINE ANOTHER 2% IN JUNE,"Privately owned housing starts in June were at a seasonally adjusted annual rate of 1,559,000, which is 2% below the revised May estimate of 1,591,000 and is 6.3% below the June 2021 rate of 1,664,000, according to the U.S. Census Bureau and the Department of Housing and Urban Development.",Symone Strong,https://www.builderonline.com/data-analysis/residential-construction-starts-decline-another-2-in-june_o,https://cdnassets.hw.net/dims4/GG/9f83c3c/2147483647/resize/876x876%3E/quality/90/?url=https%3A%2F%2Fcdnassets.hw.net%2Fd6%2F11%2Fde0e08214da186a0db65bc2b28c7%2Fadobestock-177509.jpeg
ANNUAL FOREIGN INVESTMENT IN EXISTING-HOME SALES INCREASES 8.5%,"After a three-year period where foreign investment declined in U.S. residential real estate, foreign investment increased 8.5% on a year-over-year basis from April 2021 through March 2022. According to the National Association Realtors (NAR), foreign buyers purchased $59 billion worth of U.S. existing homes during the 12-month period. The total amount of properties purchased by foreign buyers—98,600— represented a 7.9% year-over-year decrease and the fewest total number of homes bought since the NAR began tracking data in 2009.",Vincent Salandro,https://www.builderonline.com/data-analysis/annual-foreign-investment-in-existing-home-sales-increases-8-5_o,https://cdnassets.hw.net/dims4/GG/c12fea8/2147483647/crop/1784x1189%2B0%2B0/resize/300x300%3E/quality/90/?url=https%3A%2F%2Fcdnassets.hw.net%2F8d%2F1a%2Fd3ffa49040dabfcb21097f6b2b6b%2Fadobestock-84490716.jpeg
AMERICA’S TOP STATES FOR BUSINESS STUDY REVEALS THE 10 MOST STABLE HOUSING MARKETS,"As the housing market is forecasted to cool, CNBC’s America’s Top States for Business study has released its results including the 10 most stable housing markets in the nation. For businesses looking at prospective locations, the study considers housing stability as a part of the broader economy category, making up 13% of the overall score this year.",No Author name,https://www.builderonline.com/data-analysis/americas-top-states-for-business-study-reveals-the-10-most-stable-housing-markets_c,None
NAHB/WELLS FARGO HOUSING MARKET INDEX DROPS 12 POINTS IN JULY,"Builder confidence plummeted in July as increased interest rates and high inflation stalled the housing market by slowing sales and buyer traffic, reports the NAHB.",Symone Strong,https://www.builderonline.com/data-analysis/nahb-wells-fargo-housing-market-index-drops-12-points-in-july_o,https://cdnassets.hw.net/dims4/GG/fe139df/2147483647/resize/876x%3E/quality/90/?url=https%3A%2F%2Fcdnassets.hw.net%2F35%2F7d%2F2328f52b42e4930a6d87161cda90%2Fadobestock-262481598.jpeg
NAHB: SOFTWOOD LUMBER PRICE VOLATILITY ADDING MORE THAN $14K TO NEW-HOME PRICES,"The NAHB has tracked the relationship between softwood lumber price volatility and the average price of a new single-family home and a new multifamily home at several points during the pandemic. While prices have settled from their highs in the spring of 2021, when softwood lumber prices added approximately $36,000 to the price of an average new single-family home, softwood lumber prices are still contributing to price appreciation in both the single-family and multifamily sectors, according to the NAHB.",No Author name,https://www.builderonline.com/data-analysis/nahb-softwood-lumber-price-volatility-adding-more-than-14k-to-new-home-prices_c,None
CONSTRUCTION INPUT PRICES INCREASED 20.1% YEAR-OVER-YEAR IN JUNE,"Construction input prices in June were 20.1% higher than prices in June 2021, while prices increased 1.9% in June compared with May, according to an Associated Builders and Contractors (ABC) analysis of U.S. Bureau of Labor Statistics’ Product Price Index data.",BUILDER Staff,https://www.builderonline.com/data-analysis/construction-input-prices-increased-20-1-year-over-year-in-june_o,https://cdnassets.hw.net/dims4/GG/4244f72/2147483647/resize/300x%3E/quality/90/?url=https%3A%2F%2Fcdnassets.hw.net%2F44%2F1e%2F03f98157468ba9354062c70c32ae%2Fadobestock-64972724.jpeg
