Article Title,Article Description,Article Author,Article Link,Article Image
NONFARM PAYROLL EMPLOYMENT ACCELERATES IN FEBRUARY WITH LARGEST MONTHLY GAIN SINCE JULY 2021,"Total nonfarm payroll employment increased by 678,000 in February, an improvement over the strong 467,000 jobs added in January, according to the latest jobs report from the U.S. Bureau of Labor Statistics. The unemployment rate in February decreased 0.2 percentage points from January to 3.8%.",Vincent Salandro,https://www.builderonline.com/data-analysis/nonfarm-payroll-employment-accelerates-in-february-with-largest-monthly-gain-since-july-2021_o,https://cdnassets.hw.net/dims4/GG/cac74cf/2147483647/resize/876x%3E/quality/90/?url=https%3A%2F%2Fcdnassets.hw.net%2Fdd%2Fa9%2F1e7b38cd465498983181e370df89%2Fproxy-50.jpg
WILL HOUSING DEMAND OUTWEIGH ECONOMIC UNCERTAINTY?,"A great sense of enthusiasm could be found in the housing market in February, but something else started to creep in—a mild sense of panic.",Ali Wolf,https://www.builderonline.com/data-analysis/will-housing-demand-outweigh-economic-uncertainty_o,https://cdnassets.hw.net/dims4/GG/83b0eb1/2147483647/resize/876x%3E/quality/90/?url=https%3A%2F%2Fcdnassets.hw.net%2F39%2F3a%2F3b6df757450bb2f4ec0d800e7a3e%2Fadobestock-381341561.jpg
NAHB: PRIVATE RESIDENTIAL SPENDING RISES AGAIN IN JANUARY,"Total private residential construction spending increased 1.3% in January to a seasonally adjusted annual rate of $829.4 billion, according to an NAHB analysis of Census Construction Spending data. The NAHB says total private spending in the industry in January was 13.4% higher than a year ago.",No Author name,https://www.builderonline.com/data-analysis/nahb-private-residential-spending-rises-again-in-january_c,None
SINGLE-FAMILY HOME SIZES CONTINUE TO INCREASE,"One of the results of the pandemic was the need for more residential space to accommodate home offices and remote learning. Recent data from the NAHB confirms that the size of new single-family homes continues to increase, likely to allow homes to serve multiple functions for homeowners.",No Author name,https://www.builderonline.com/data-analysis/single-family-home-sizes-continue-to-increase_c,None
PENDING HOME SALES FALL FOR THIRD CONSECUTIVE MONTH IN JANUARY,"Pending home sales dropped in January, marking the third consecutive month with a decrease in transactions, according to the National Association of Realtors (NAR). The Pending Home Sales Index (PHSI) fell 5.7% to 109.5 in January, and transactions decreased 9.5% on a year-over-year basis. An index level of 100 is equal to the level of contract activity in 2001.",Vincent Salandro,https://www.builderonline.com/data-analysis/pending-home-sales-fall-for-third-consecutive-month-in-january_o,https://cdnassets.hw.net/dims4/GG/bf091f2/2147483647/resize/876x%3E/quality/90/?url=https%3A%2F%2Fcdnassets.hw.net%2F0b%2Ffa%2F2cc0dd6a4205bd00d41ea206d6c9%2Fadobestock-264343706.jpeg
NEW-HOME SALES DECLINE IN JANUARY,"Sales of new single‐family houses in January were at a seasonally adjusted annual rate of 801,000, according to estimates by the U.S. Census Bureau and the Department of Housing and Urban Development. This is 4.5% below the revised December rate of 839,000 and is 19.3% below the January 2021 estimate of 993,000.",Symone Strong,https://www.builderonline.com/data-analysis/new-home-sales-decline-in-january_o,https://cdnassets.hw.net/dims4/GG/ca0b53d/2147483647/resize/876x%3E/quality/90/?url=https%3A%2F%2Fcdnassets.hw.net%2Fec%2F51%2Fd95cc4bf451b8d045e8d06b14c81%2Ffor-sale-sign.jpeg
"ABC: INDUSTRY NEEDS 650,000 ADDITIONAL WORKERS IN 2022 TO MEET DEMAND","The construction industry will need to attract nearly 650,000 additional workers on top of the normal hiring pace in 2022 to meet the demand for labor, according to a model developed by the Associated Builders and Contractors (ABC).",Vincent Salandro,https://www.builderonline.com/data-analysis/abc-industry-needs-650-000-additional-workers-in-2022-to-meet-demand_o,https://cdnassets.hw.net/dims4/GG/358178e/2147483647/resize/300x%3E/quality/90/?url=https%3A%2F%2Fcdnassets.hw.net%2Fea%2Ff8%2Fe2cc890848849aedfce81f720ab4%2Fnew.jpg
"APPROXIMATELY 762,000 NEW HOMES WERE SOLD IN 2021",,Symone Strong,https://www.builderonline.com/data-analysis/approximately-762-000-new-homes-were-sold-in-2021_o,https://cdnassets.hw.net/dims4/GG/afc15ce/2147483647/resize/876x%3E/quality/90/?url=https%3A%2F%2Fcdnassets.hw.net%2F30%2Fb7%2Ffb03629342338dc1a4c650e99c8d%2Fadobestock-10585522.jpeg
CASE-SHILLER INDEX POSTS 18.8% ANNUAL GAIN IN NOVEMBER,,Vincent Salandro,https://www.builderonline.com/data-analysis/case-shiller-index-posts-18-8-annual-gain-in-november_o,https://cdnassets.hw.net/dims4/GG/de8f973/2147483647/resize/876x%3E/quality/90/?url=https%3A%2F%2Fcdnassets.hw.net%2Fe6%2Fe0%2F820a82e44fcfabd4138dc4754d4c%2Fadobestock-10520585.jpeg
NEW HOME PSI SLIPS MONTH OVER MONTH AND YEAR OVER YEAR IN DECEMBER,"Zonda’s New Home Pending Sales Index (PSI) decreased to 157.3 for December, representing a 4% decline from November and a 5.3% decline from December 2020.",Symone Strong,https://www.builderonline.com/data-analysis/new-home-psi-slips-month-over-month-and-year-over-year-in-december_o,https://cdnassets.hw.net/dims4/GG/fe139df/2147483647/resize/876x%3E/quality/90/?url=https%3A%2F%2Fcdnassets.hw.net%2F35%2F7d%2F2328f52b42e4930a6d87161cda90%2Fadobestock-262481598.jpeg
SHARE OF ADULTS PLANNING TO PURCHASE A HOME DECLINES IN Q4,"Higher home prices and low housing availability are leading some Americans to postpone their homeownership plans, according to the NAHB’s Housing Trends Report. The share of adults planning to purchase a home within 12 months fell for the second consecutive quarter in the fourth quarter to 15%.",No Author name,https://www.builderonline.com/data-analysis/share-of-adults-planning-to-purchase-a-home-declines-in-q4_c,None
ANNUAL EXISTING HOME SALES REACH HIGHEST LEVEL SINCE 2006,"Existing home sales decreased in December to a seasonally adjusted annual rate of 6.18 million, snapping a run of three consecutive months of gains, according to the National Association of Realtors (NAR). Total existing home sales, which include single-family homes, townhomes, condominiums, and co-ops, declined 4.6% from November to December and 7.1% on a year-over-year (YOY) basis. Despite the decline in December, overall sales for 2021 increased 8.5%, according to the NAR.",Vincent Salandro,https://www.builderonline.com/data-analysis/annual-existing-home-sales-reach-highest-level-since-2006_o,https://cdnassets.hw.net/dims4/GG/cde7aaa/2147483647/resize/300x%3E/quality/90/?url=https%3A%2F%2Fcdnassets.hw.net%2F8f%2F88%2F4a6d18c4415986f1f6c3c7e50589%2Fadobestock-77315243.jpeg
HOUSING ACTIVITY IN 2021 ENDS ON STRONG NOTE,"An estimated 1,595,100 housing units were started in 2021, or a 15.6% increase from the 2020 figure of 1,379,600, according to the final new residential construction report of 2021 from the U.S. Census Bureau and the Department of Housing and Urban Development.",Symone Strong,https://www.builderonline.com/data-analysis/housing-activity-in-2021-ends-on-strong-note_o,https://cdnassets.hw.net/dims4/GG/32e9d2f/2147483647/resize/876x%3E/quality/90/?url=https%3A%2F%2Fcdnassets.hw.net%2Fee%2Fe1%2F7f0c5b9a492baa29ad29ab6d3ea0%2Fadobestock-3120383.jpeg
BUILDER CONFIDENCE DIPS IN JANUARY ON INFLATION CONCERNS,"Growing inflation concerns and ongoing supply chain disruptions snapped a four-month rise in builder sentiment in the first month of 2022. The NAHB/Wells Fargo Housing Market Index (HMI), measuring builder sentiment in the market for newly built single-family homes, moved one point lower to 83 in January.",Symone Strong,https://www.builderonline.com/data-analysis/builder-confidence-dips-in-january-on-inflation-concerns_o,https://cdnassets.hw.net/dims4/GG/5dfd730/2147483647/resize/876x%3E/quality/90/?url=https%3A%2F%2Fcdnassets.hw.net%2Fa3%2F5d%2Feb705605447cad9c0707b2c44367%2Fadobestock-182791397.jpeg
NKBA PROJECTS RAPID GROWTH FOR KITCHEN AND BATH INDUSTRY IN 2022,"The kitchen and bath industry is projected to experience a 19% year-over-year (YOY) increase in spending to $199 billion from $167 billion in 2021, according to the National Kitchen & Bath Association’s (NKBA) Kitchen & Bath Market Outlook for 2022 report. The report also forecasts spending on new construction will see a 21% spending increase, although new housing starts are only predicted to increase by 6% in 2022.",Vincent Salandro,https://www.builderonline.com/data-analysis/nkba-projects-rapid-growth-for-kitchen-and-bath-industry-in-2022_o,https://cdnassets.hw.net/dims4/GG/bb02276/2147483647/resize/300x%3E/quality/90/?url=https%3A%2F%2Fcdnassets.hw.net%2Fea%2F7d%2Fd61284cf49568341f8243d84efcd%2Fnkba-logomaster-primary.jpg
LUMBER PRICE VOLATILITY AT 75-YEAR HIGH,"The prices of goods used in residential construction increased 1.5% in December, driven by large price increases for wood products, according to the latest Producer Price Index (PPI) report released by the Bureau of Labor Statistics. Building material prices increased 18.9% since December 2020 while the PPI for softwood lumber increased 24.4% in December. According to the NAHB’s Eye on Housing blog, softwood lumber prices have increased 44.5% since September 2021.",No Author name,https://www.builderonline.com/data-analysis/lumber-price-volatility-at-75-year-high_c,None
INFLATION REACHES HIGHEST LEVEL SINCE 1982,"Consumer prices increased 7% in December on a year-over-year (YOY) basis, the largest YOY gain since June 1982. Supply-chain constraints and strong consumer demand related to the pandemic and the reopening of the economy have contributed to recent price increases in some sectors, according to the NAHB.",No Author name,https://www.builderonline.com/data-analysis/inflation-reaches-highest-level-since-1982_c,None
NAHB’S HBGI SHOWS GROWTH IN SECOND HOME COUNTIES DURING THIRD QUARTER OF 2021,"Single-family and multifamily home building showed gains in second home counties—defined as those having a high proportion of housing units that are not their owners’ primary residence—in the third quarter, according to the NAHB’s latest Home Building Geography Index. The growth rate for single-family home building in second markets on a year-over-year basis was 36.1% in the third quarter and the year-over-year growth rate for multifamily building was 24.7%, according to the NAHB’s Eye on Housing blog.",No Author name,https://www.builderonline.com/data-analysis/nahbs-hbgi-shows-growth-in-second-home-counties-during-third-quarter-of-2021_c,None
NEW-HOME SALES RISE IN NOVEMBER,"Sales of new single-family homes increased 12.4% in November; however, this is 14% below the November 2020 estimate, according to the U.S. Census Bureau and the Department of Housing and Urban Development.",Christine Serlin,https://www.builderonline.com/data-analysis/new-home-sales-rise-in-november_o,https://cdnassets.hw.net/dims4/GG/bcef2cb/2147483647/resize/876x%3E/quality/90/?url=https%3A%2F%2Fcdnassets.hw.net%2Fb0%2Fab%2Fbe48f3f1432bb84dc972eecba7e0%2Fadobestock-43096.jpeg
EXISTING HOME SALES INCREASE FOR THIRD CONSECUTIVE MONTH IN NOVEMBER,"Existing home sales increased in November to a seasonally adjusted annual rate of 6.46 million, marking the third consecutive month of growth, according to the latest monthly report from the National Association of Realtors (NAR). Total existing home sales, which include single-family homes, townhomes, condos, and co-ops, increased 1.9% from October to November but are down 2% from November 2020.",Vincent Salandro,https://www.builderonline.com/data-analysis/existing-home-sales-increase-for-third-consecutive-month-in-november_o,https://cdnassets.hw.net/dims4/GG/f69dc0c/2147483647/resize/300x%3E/quality/90/?url=https%3A%2F%2Fcdnassets.hw.net%2Fe8%2Ff4%2F66a76b9a40e58ada837ae8501547%2Fadobestock-97067868.jpeg
NOVEMBER NEW HOME PENDING SALES RISE ABOVE 2020 LEVELS,The New Home Pending Sales Index (PSI) from Zonda increased 3.6% from October to November to a reading of 166.1. The PSI reading is a 2% increase on a year-over-year (YOY) basis from November 2020 and is 42.5% higher than the PSI reading in November 2019.,Vincent Salandro,https://www.builderonline.com/data-analysis/november-new-home-pending-sales-rise-above-2020-levels_o,https://cdnassets.hw.net/dims4/GG/9baf82a/2147483647/resize/300x%3E/quality/90/?url=https%3A%2F%2Fcdnassets.hw.net%2F2a%2F0b%2Faa18bb4c469f9a2b0ea9c3f0e782%2Fadobestock-64479058.jpeg
STUDY: GOOGLE SEARCH TERMS AMONG BUYERS AND RENTERS SUPPORT K-SHAPED ECONOMIC RECOVERY THEORY,"As home prices increased significantly during the COVID-19 pandemic, prospective home buyers increased their Google searches for “affordable homes for sale” significantly from 2019 to 2020 and 2021, according to an analysis by Point2Homes. Searches for “affordable homes for sale” increased 108% from 2019 to 2020 and increased a further 30% from 2020 to 2021.",Vincent Salandro,https://www.builderonline.com/data-analysis/study-google-search-terms-among-buyers-and-renters-support-k-shaped-economic-recovery-theory_o,https://cdnassets.hw.net/dims4/GG/4b0ea75/2147483647/resize/300x%3E/quality/90/?url=https%3A%2F%2Fcdnassets.hw.net%2F6b%2F89%2F55c65c454c648ec7e649031aa40f%2Fscreen-shot-2018-12-19-at-1.27.12%20PM.png
"HOUSING STARTS SURGE IN NOVEMBER, SHOWING PROMISE FOR SPRING SELLING","Privately owned housing starts in November were at a seasonally adjusted annual rate of 1,679,000, which is 11.8% above the revised October estimate of 1,502,000 and is 8.3% above the November 2020 rate of 1,551,000, according to the U.S. Census Bureau and the Department of Housing and Urban Development.",Symone Strong,https://www.builderonline.com/data-analysis/housing-starts-surge-in-november-showing-promise-for-spring-selling_o,https://cdnassets.hw.net/dims4/GG/d0ee208/2147483647/resize/876x%3E/quality/90/?url=https%3A%2F%2Fcdnassets.hw.net%2Fa7%2F5b%2F8b94b0b84c7682985ebf7ce454b4%2Fnew-home-framing-to-completion.jpg
COMMERCIAL CONSTRUCTION RECOVERY IMPACTED BY LABOR AND MATERIAL SHORTAGES,"The U.S. Chamber of Commerce Commercial Construction Index (CCI) dropped one point during the quarter to 65 due to several ongoing struggles for the construction industry, including rising costs, the skilled labor shortage, and supply shortages. Contractors’ revenue expectations, a key driver of the overall index score, fell for the first time since the beginning of the pandemic.",Vincent Salandro,https://www.builderonline.com/data-analysis/commercial-construction-recovery-impacted-by-labor-and-material-shortages_o,https://cdnassets.hw.net/dims4/GG/95c8c0d/2147483647/resize/300x%3E/quality/90/?url=https%3A%2F%2Fcdnassets.hw.net%2F3d%2F82%2F28b5c1974ff1b61e06ec143da559%2Fadobestock-90594565.jpeg
PPI FOR RESIDENTIAL CONSTRUCTION INPUTS INCHES HIGHER,"The price of goods used in residential construction increased 1.8% in November, driven by price increases in nearly every category, according to the latest Producer Price Index (PPI) released by the Bureau of Labor Statistics. Building materials prices have increased 14.1% year to date (YTD), significantly above the average YTD growth of 1.5% over the past five years, according to the NAHB.",No Author name,https://www.builderonline.com/data-analysis/ppi-for-residential-construction-inputs-inches-higher_c,None
ZONDA’S NEW METRIC OFFERS A BETTER WAY TO CALCULATE HOUSING AFFORDABILITY,"Affordability is one of the key metrics in housing. Traditional measures make assumptions based on home prices and local incomes. Those metrics, however, fall short now that the pandemic has changed how and where some people live. Enter the Zonda Affordability Ratio (ZAR), a new metric that reflects the true state of housing affordability accounting for the work-from-home economy.",Ali Wolf,https://www.builderonline.com/data-analysis/zondas-new-metric-offers-a-better-way-to-calculate-housing-affordability_o,https://cdnassets.hw.net/dims4/GG/ddc0a64/2147483647/resize/876x%3E/quality/90/?url=https%3A%2F%2Fcdnassets.hw.net%2F49%2Fab%2Fdd69469045ad9e96e02585a1cadd%2Fadobestock-124263893-2.jpeg
BUILDER SENTIMENT REMAINS STRONG AT END OF 2021,"Despite inflation concerns and ongoing production bottlenecks, builder confidence edged higher for the fourth consecutive month on strong consumer demand and limited existing inventory, reports the NAHB.",Symone Strong,https://www.builderonline.com/data-analysis/builder-sentiment-remains-strong-at-end-of-2021_o,https://cdnassets.hw.net/dims4/GG/35d0fea/2147483647/resize/876x%3E/quality/90/?url=https%3A%2F%2Fcdnassets.hw.net%2F85%2F4d%2Fac25470a4ce5b114996445baa6b5%2Fadobestock-4069643.jpeg
WHERE ARE THE BEST SUBURBS FOR CITY-LIKE LIVING?,"While the suburbs have not always been able to compete with cities in terms of lifestyle offerings, shifting expectations in recent years have caused many suburban areas to offer more than the typical bedroom community. In addition to quality housing, suburban developments have begun to meet homeowner demand for shopping and entertainment options, safety, and job opportunities as well.",Vincent Salandro,https://www.builderonline.com/data-analysis/where-are-the-best-suburbs-for-city-like-living_o,https://cdnassets.hw.net/dims4/GG/ac621fd/2147483647/resize/300x%3E/quality/90/?url=https%3A%2F%2Fcdnassets.hw.net%2Fdb%2F66%2Feb2f349441ed9d7a4d2ed36bcfc6%2Fadobestock-91803219.jpeg
FANNIE MAE: ECONOMIC PESSIMISM REACHES GREATEST LEVEL IN 10 YEARS,"The Fannie Mae Home Purchase Sentiment Index (HPSI) decreased 0.8 points to 74.7 in November as consumers expressed disparate views of home buying and selling conditions and their greatest economic pessimism in 10 years. Approximately three-fourths of respondents in November reported it's a good time to sell a home, compared with 29% of respondents who reported it's a good time to buy a home.",BUILDER Staff,https://www.builderonline.com/data-analysis/fannie-mae-economic-pessimism-reaches-greatest-level-in-10-years_o,https://cdnassets.hw.net/dims4/GG/ebb5c5b/2147483647/resize/300x%3E/quality/90/?url=https%3A%2F%2Fcdnassets.hw.net%2F5f%2Fce%2Fb9e8617b4cfe9d9642ca15ea3811%2Fbalancing-scale-money-house-resizefornl.jpg
HBGI SHOWS LESSENED SUBURBAN SHIFT IN Q3,"While the COVID-19-driven suburban shift for single-family home building is continuing, new data reveals that higher density markets are making a comeback as well, according to the third quarter NAHB Home Building Geography Index (HBGI). There were gains for housing production in both urban core and exurban areas due to workers transitioning back to the workplace, according to the NAHB’s Eye on Housing blog.",No Author name,https://www.builderonline.com/data-analysis/hbgi-shows-lessened-suburban-shift-in-q3_c,None
U.S. MEDIAN HOUSEHOLD WEALTH INCREASES BY 17.6% FROM 2016 TO 2019,"The median net worth of U.S. households has increased $24,000, or 17.6%, to $127,000 in 2019 from $103,000 in 2016, according to the Distribution of Wealth in America Since 2016 report from the Mortgage Bankers Association’s (MBA) Research Institute for Housing America (RIHA). The $127,000 median net worth for households is the highest amount observed since 2007.",Vincent Salandro,https://www.builderonline.com/data-analysis/u-s-median-household-wealth-increases-by-17-6-from-2016-to-2019_o,https://cdnassets.hw.net/dims4/GG/9efb629/2147483647/resize/300x%3E/quality/90/?url=https%3A%2F%2Fcdnassets.hw.net%2Ff2%2F08%2Fac6141924ba19f203d0b40b250fc%2Fadobestock-57889343.jpeg
"JOB GROWTH DECELERATES WITH 210,000 NONFARM PAYROLLS ADDED IN NOVEMBER","Total nonfarm payroll employment rose by 210,000 in November, an increase smaller than the 531,000 new positions added in October, according to the latest jobs report from the U.S. Bureau of Labor Statistics. The unemployment rate decreased by 0.4 percentage points to 4.2% in November.",Vincent Salandro,https://www.builderonline.com/data-analysis/job-growth-decelerates-with-210-000-nonfarm-payrolls-added-in-november_o,https://cdnassets.hw.net/dims4/GG/9aa33a5/2147483647/resize/300x%3E/quality/90/?url=https%3A%2F%2Fcdnassets.hw.net%2F55%2Fd3%2Fe7bd6502433a8f67a333952ba27c%2Fadobestock-57158359.jpeg
RISING FHA LOAN LIMITS MATCH RECORD HOME PRICE APPRECIATION,Ninety-nine percent of counties in the nation will start 2022 with higher Federal Housing Administration (FHA) loan limits than 2021. Home price appreciation moved to record highs in 2021 as the housing market continued to boom through the pandemic. Rising FHA loan limits are particularly important in a rising home price environment as they help some Americans secure a mortgage by offering buyers lower down payment and credit score options.,Ali Wolf,https://www.builderonline.com/data-analysis/rising-fha-loan-limits-match-record-home-price-appreciation_o,https://cdnassets.hw.net/dims4/GG/7f15a80/2147483647/resize/876x%3E/quality/90/?url=https%3A%2F%2Fcdnassets.hw.net%2F51%2Fba%2Fc45374f04e2b90ec6929c9d6ae4a%2Fproxy-14.jpg
CASE-SHILLER INDEX REPORTS 19.5% ANNUAL GAIN IN SEPTEMBER,"The S&P CoreLogic Case-Shiller U.S. National Home Price NSA Index, which covers all nine U.S. Census divisions, reported a 19.5% annual gain in September, down from 19.8% in the previous month.",Symone Strong,https://www.builderonline.com/data-analysis/case-shiller-index-reports-19-5-annual-gain-in-september_o,https://cdnassets.hw.net/dims4/GG/4d0fa92/2147483647/resize/876x%3E/quality/90/?url=https%3A%2F%2Fcdnassets.hw.net%2F48%2F42%2F9ab4d1b84aedb64dc19de64e3ed4%2Fadobestock-121386700-b.jpeg
"PENDING HOME SALES BOUNCE BACK, INCREASE 7.5% IN OCTOBER","Pending home sales made a comeback in October, rebounding after a decline in September, according to the National Association of Realtors (NAR). The Pending Home Sales Index (PHSI) rose 7.5% to 125.2 in October. An index reading of 100 is equal to the level of contract activity in 2001. On a year-over-year basis, signings fell 1.4%.",Vincent Salandro,https://www.builderonline.com/data-analysis/pending-home-sales-bounce-back-increase-7-5-in-october_o,https://cdnassets.hw.net/dims4/GG/141df54/2147483647/resize/300x%3E/quality/90/?url=https%3A%2F%2Fcdnassets.hw.net%2F0d%2F28%2F8063cd9b460894f26e51c2d5a48e%2Fadobestock-112321215.jpeg
NEW-HOME SALES FLAT IN OCTOBER,"Sales of new single‐family houses in October were at a seasonally adjusted annual rate of 745,000, according to estimates released by the U.S. Census Bureau and the Department of Housing and Urban Development. This is 0.4% above the revised September rate of 742,000 but is 23.1% below the October 2020 estimate of 969,000.",Symone Strong,https://www.builderonline.com/data-analysis/new-home-sales-flat-in-october_o,https://cdnassets.hw.net/dims4/GG/ab408c8/2147483647/resize/876x%3E/quality/90/?url=https%3A%2F%2Fcdnassets.hw.net%2Fde%2F5a%2Fbcd7526245fda79a49fb2668ba88%2Fproxy-6.jfif
OCTOBER EXISTING HOME SALES INCH UP 0.8%,"Existing home sales increased in October, marking two straight months of growth, according to the latest monthly report from the National Association of Realtors (NAR).",Symone Strong,https://www.builderonline.com/data-analysis/october-existing-home-sales-inch-up-0-8_o,https://cdnassets.hw.net/dims4/GG/7f18597/2147483647/resize/876x%3E/quality/90/?url=https%3A%2F%2Fcdnassets.hw.net%2F8f%2F88%2F4a6d18c4415986f1f6c3c7e50589%2Fadobestock-77315243.jpeg
NEW HOME PENDING SALES INDEX POSTS THIRD CONSECUTIVE MONTH-OVER-MONTH INCREASE,"The New Home Pending Sales Index (PSI) from Zonda increased 3.2% from September to October to a reading of 156.6. The reading marks a 6.5% decline from October 2020 but is 35.2% higher than in October 2019. According to the PSI, the housing market is below peak activity from January 2021, trailing the cycle high by 10% on a seasonally adjusted basis. The market remains 25.7% above the pre-pandemic high from February 2020.",Vincent Salandro,https://www.builderonline.com/data-analysis/new-home-pending-sales-index-posts-third-consecutive-month-over-month-increase_o,https://cdnassets.hw.net/dims4/GG/a865654/2147483647/resize/300x%3E/quality/90/?url=https%3A%2F%2Fcdnassets.hw.net%2F0f%2F25%2F68b7633048ec8cbd116c3d51d0cc%2Fproxy-34.jpg
MORTGAGE APPLICATIONS DECREASED 15.2% YEAR OVER YEAR IN OCTOBER,"Mortgage applications for new-home purchases decreased 15.2% in October compared with a year ago, according to the latest Mortgage Bankers Association (MBA) Builder Application Survey (BAS). Despite the year-over-year declines, applications increased by 6% from September.",Vincent Salandro,https://www.builderonline.com/data-analysis/mortgage-applications-decreased-15-2-year-over-year-in-october_o,https://cdnassets.hw.net/dims4/GG/95c5f9b/2147483647/resize/300x%3E/quality/90/?url=https%3A%2F%2Fcdnassets.hw.net%2Fb4%2F65%2Ffc0e0a1d4081b48e51661bb49bf6%2Fadobestock-1508028.jpeg
SINGLE-FAMILY BUILD-TO-RENT STARTS REACH HIGHEST QUARTERLY VOLUME,"According to an NAHB analysis of Census Bureau data, the number of single-family build-to-rent (SFBTR) construction starts reached its highest quarterly volume on record during the third quarter. Over the past four quarters, 47,000 such homes began construction, which represents a 17.5% gain compared with the 40,000 estimated SFBTR starts for the four prior quarters.",No Author name,https://www.builderonline.com/data-analysis/single-family-build-to-rent-starts-reach-highest-quarterly-volume_c,None
