Article Title,Article Description,Article Author,Article Link,Article Image
CASE-SHILLER INDEX REPORTS CONTINUED HOME PRICE DECELERATION IN SEPTEMBER,"The S&P CoreLogic Case-Shiller U.S. National Home Price NSA Index, which covers all nine U.S. census divisions, posted a 10.6% annual gain in September, down from 12.9% year-over-year growth in the previous month.",Vincent Salandro,https://www.builderonline.com/data-analysis/case-shiller-index-reports-continued-home-price-deceleration-in-september_o,https://cdnassets.hw.net/dims4/GG/39de89f/2147483647/resize/300x%3E/quality/90/?url=https%3A%2F%2Fcdnassets.hw.net%2F37%2Fa3%2Fe140777e4b0e9347e82897c5711a%2Fhouses-graph-falling.jpg
PAYMENT-TO-INCOME RATIO SHEDS LIGHT ON REGIONAL HOUSING TRENDS,"The housing market needs buyer affordability, consumer confidence, and a healthy labor market to function properly, all of which are currently in question. In fact, new-home sales are down 35.4% following more than two years of relentless home price appreciation and mortgage rates reaching the highest levels in 20 years.",Ali Wolf,https://www.builderonline.com/data-analysis/payment-to-income-ratio-sheds-light-on-regional-housing-trends_o,https://cdnassets.hw.net/dims4/GG/a68be40/2147483647/resize/876x%3E/quality/90/?url=https%3A%2F%2Fcdnassets.hw.net%2F50%2F59%2F7c5e915a4de5bdc92eff51bed056%2Fadobestock-535850492.jpeg
NEW RESIDENTIAL SALES REPORT SHOWS SMALL UPTICK IN OCTOBER,"Sales of new single‐family houses in October were at a seasonally adjusted annual rate of 632,000, according to estimates released by the U.S. Census Bureau and the Department of Housing and Urban Development. This is 7.5% above the revised September rate of 588,000 but 5.8% below the October 2021 estimate of 671,000.",Symone Strong,https://www.builderonline.com/data-analysis/new-residential-sales-report-shows-small-uptick-in-october_o,https://cdnassets.hw.net/dims4/GG/84fd225/2147483647/resize/876x%3E/quality/90/?url=https%3A%2F%2Fcdnassets.hw.net%2F9b%2Fde%2F38aa8b994e27a284303bce9cdb6e%2Fhome-for-sale-sign.jpg
SHARE OF CUSTOM HOME STARTS INCREASES DURING THIRD QUARTER,"Custom home building expanded during the third quarter of 2022 despite broader weakness in the overall housing market, according to an NAHB analysis of Census Data from the Quarterly Starts and Completions by Purpose and Design Survey. The 59,000 custom building starts in the third quarter represented a 5% increase compared with the third quarter of 2021.",No Author name,https://www.builderonline.com/data-analysis/share-of-custom-home-starts-increases-during-third-quarter_c,None
STUDY: RISING PRICES AND MORTGAGE RATES HAVE ERODED AFFORDABILITY,"As a result of rising home prices and mortgage rates, home buyers in the 100 largest U.S. cities can no longer afford the amount of space they could a year ago, with the average buyer losing the equivalent of one to nine bedrooms, according to an analysis by Point2Homes. For example, residents in New York City earning the median income were able to afford a $320,000 home under the conditions of a 20% down payment and a 30-year, fixed-rate mortgage that wouldn’t require more than 30% of monthly income. In November 2022, the average New York City resident could now only afford a $245,997 home, according to Point2Homes.",Vincent Salandro,https://www.builderonline.com/data-analysis/study-rising-prices-and-mortgage-rates-have-eroded-affordability_o,https://cdnassets.hw.net/dims4/GG/9efb629/2147483647/resize/300x%3E/quality/90/?url=https%3A%2F%2Fcdnassets.hw.net%2Ff2%2F08%2Fac6141924ba19f203d0b40b250fc%2Fadobestock-57889343.jpeg
NEW-HOME SALES DECLINE BY 34.1% ON A YEAR-OVER-YEAR BASIS IN OCTOBER,"New-home sales slowed in October, reflecting growing uncertainty in the overall economy and housing market. According to the Zonda New Home Market Update, there were approximately 467,082 new-home sales on a seasonally adjusted annual basis in October, representing a 34.1% decline on a year-over-year basis.",Vincent Salandro,https://www.builderonline.com/data-analysis/new-home-sales-decline-by-34-1-on-a-year-over-year-basis-in-october_o,https://cdnassets.hw.net/dims4/GG/64f3bc7/2147483647/resize/300x%3E/quality/90/?url=https%3A%2F%2Fcdnassets.hw.net%2Fcb%2F3c%2F82692e704277bc6fd241346078cb%2Fadobestock-54953340.jpeg
NEW SINGLE-FAMILY HOMES TREND SMALLER IN THIRD QUARTER,"The trend of increasing sizes for new single-family homes brought about by the COVID-19 pandemic appears to be reversing, as the median single-family square floor area for homes started in the third quarter declined, according to an analysis by the NAHB.",No Author name,https://www.builderonline.com/data-analysis/new-single-family-homes-trend-smaller-in-third-quarter_c,None
CONSTRUCTION EMPLOYMENT INCREASES IN 27 STATES IN OCTOBER AS SECTOR JOB OPENINGS SURGE,"Construction employment grew in 27 states on a month-over-month basis from September to October, according to an analysis of government data by the Associated General Contractors of America (AGC). However, the association noted many more companies would have hired employees if qualified applicants were available. The discrepancy between hires and demand for labor is reflected by the increasing number of construction job openings in October.",BUILDER Staff,https://www.builderonline.com/data-analysis/construction-employment-increases-in-27-states-in-october-as-sector-job-openings-surge_o,https://cdnassets.hw.net/dims4/GG/a4b43b3/2147483647/resize/300x%3E/quality/90/?url=https%3A%2F%2Fcdnassets.hw.net%2Fbd%2F39%2F752a29ef44a98bf89bae148286fd%2Fnew-house-construction-worker-connecting-pipes.jpg
PACE OF SINGLE-FAMILY BUILD-TO-RENT STARTS COOLS IN THIRD QUARTER,"After an “exceptionally strong second quarter” for rental housing production, single-family build-for-rent (SFBFR) construction leveled off during the third quarter of 2022. This reflects trends in the overall housing market, which slowed during the third quarter as well. According to an NAHB analysis of data from the Census Bureau’s Quarterly Starts and Completions by Purpose and Design, there were approximately 16,000 SFBFR starts during the third quarter, 6% lower than the third quarter of 2021.",No Author name,https://www.builderonline.com/data-analysis/pace-of-single-family-build-to-rent-starts-cools-in-third-quarter_c,None
"GEN Z STRIVES TO BUY, BUT CONCERNED ABOUT THE OBSTACLES","New survey results from Freddie Mac reveal Generation Z, or the demographic cohort following millennials, has a largely positive outlook on the idea of homeownership, though they are increasingly leery of the obstacles they may face.",Symone Strong,https://www.builderonline.com/data-analysis/gen-z-strives-to-buy-but-concerned-about-the-obstacles_o,https://cdnassets.hw.net/dims4/GG/9436aa0/2147483647/resize/876x%3E/quality/90/?url=https%3A%2F%2Fcdnassets.hw.net%2F09%2Fc2%2F3870707645c881e115001d03170b%2Fscreen-shot-2018-09-10-at-11.18.09%20AM.png
AIA: OCTOBER BILLINGS DIP DRAMATICALLY,"The American Institute of Architects monthly Architecture Billings Index came in at 47.7, a dramatic 4-point decrease from September's score of 51.7 and the first decline in billings since January 2021. The ABI is a leading economic indicator of construction activity in the U.S. and reflects a nine- to 12-month lead time between architecture billings and construction spending nationally, regionally, and by project type. A score above 50 represents an increase in billings from the previous month, while a score below 50 represents a contraction.",ARCHITECT Staff,https://www.builderonline.com/data-analysis/aia-october-billings-dip-dramatically_s,https://cdnassets.hw.net/dims4/GG/e17a1ed/2147483647/resize/876x%3E/quality/90/?url=https%3A%2F%2Fcdnassets.hw.net%2Fdb%2F49%2F90e9a1ef4d7097877b777e1a7b34%2Fjobs-abi-template-oct-2022.jpg
EXISTING-HOME SALES DECREASE 5.9% IN OCTOBER,"Total existing-home sales, which include completed transactions for single-family homes, townhomes, condominiums, and co-ops, fell for the ninth straight month in October, according to the National Association of Realtors (NAR). Existing-home sales in October decreased 5.9% from September to a seasonally adjusted annual rate of 4.43 million. On a year-over-year basis, sales declined by 28.4%.",No Author name,https://www.builderonline.com/data-analysis/existing-home-sales-decrease-5-9-in-october_o,https://cdnassets.hw.net/dims4/GG/57699b5/2147483647/resize/300x%3E/quality/90/?url=https%3A%2F%2Fcdnassets.hw.net%2Fb0%2Fab%2Fbe48f3f1432bb84dc972eecba7e0%2Fadobestock-43096.jpeg
HOUSING MARKET UPDATE: RECESSION LIKELY IN 2023,"While inflation has begun to cool, it still remains up between 6% and 8% compared with last year, and the overall economy has not yet returned to a more healthy level. During Zonda’s most recent Housing Market Update, chief economist Ali Wolf says that Zonda’s expectation is the economy falls into a recession, which includes job losses on a national basis, in 2023.",Vincent Salandro,https://www.builderonline.com/data-analysis/housing-market-update-recession-likely-in-2023_o,https://cdnassets.hw.net/dims4/GG/0b62685/2147483647/resize/300x%3E/quality/90/?url=https%3A%2F%2Fcdnassets.hw.net%2Fd4%2F6a%2F00d2df524ffe88af0f59e73b6db6%2Fbalancing-scale-money-house.jpg
SINGLE-FAMILY PRODUCTION CONTINUES TO WEAKEN IN OCTOBER,,Symone Strong,https://www.builderonline.com/data-analysis/single-family-production-continues-to-weaken-in-october_o,https://cdnassets.hw.net/dims4/GG/6dca2dc/2147483647/resize/876x%3E/quality/90/?url=https%3A%2F%2Fcdnassets.hw.net%2F8e%2F42%2Ff0069a9e4ac2bbad6a4114dd4db9%2Fhouse-under-construction.jpg
"REPORT: POTENTIAL BUYERS NEED INCOMES GREATER THAN $107,000 TO AFFORD THE MEDIAN-PRICED HOME","A potential home buyer must earn $107,281 to afford the $2,682 monthly mortgage payment on the typical U.S. home, up 45.6% compared with last year, according to a . The large increase in required income is a reflection of mortgage rates that have more than doubled in the past 12 months and increasing home prices.",Vincent Salandro,https://www.builderonline.com/data-analysis/report-potential-buyers-need-incomes-greater-than-107-000-to-afford-the-median-priced-home_o,https://cdnassets.hw.net/dims4/GG/5609f05/2147483647/resize/300x%3E/quality/90/?url=https%3A%2F%2Fcdnassets.hw.net%2F18%2F71%2Fb19d7ea3484686fb6f0571ae542f%2Fadobestock-135256366.jpeg
BUILDING MATERIAL PRICES FALL FOR FOURTH TIME IN FIVE MONTHS IN OCTOBER,"The prices of building materials decreased marginally by 0.2% in October, according to the latest Producer Price Index (PPI). The October decrease marks the fourth time in five months the overall index has fallen, the first such occurrence since 2015, according to the NAHB. The price index of services inputs to residential construction decreased by 0.7% in October, marking the seventh consecutive monthly decline, and prices have fallen a total of 14% since the index last increased in March 2022.",No Author name,https://www.builderonline.com/data-analysis/building-material-prices-fall-for-fourth-time-in-five-months-in-october_c,None
BUILDER CONFIDENCE FALLS IN NOVEMBER FOR 11TH CONSECUTIVE MONTH,"Elevated interest rates, high building material costs, and declining affordability conditions are both pushing more buyers to the sidelines and dragging down builder sentiment. For the 11th consecutive month, builder confidence in the market for newly built single-family homes declined in November, according to the NAHB/Wells Fargo Housing Market Index (HMI). Builder confidence fell five points to 33 in November, the lowest confidence reading since June 2021, with the exception of the onset of the COVID-19 pandemic in the spring 2020.",Vincent Salandro,https://www.builderonline.com/data-analysis/builder-confidence-falls-in-november-for-11th-consecutive-month_o,https://cdnassets.hw.net/dims4/GG/a0485b3/2147483647/resize/300x%3E/quality/90/?url=https%3A%2F%2Fcdnassets.hw.net%2F54%2F89%2F6e60f6584f0d92496d5cc1928e6e%2Fadobestock-9965885e.jpg
SINGLE-FAMILY PERMITS DECLINE YEAR TO DATE IN SEPTEMBER,"Over the first nine months of 2022, the total number of single-family permits issued year to date represents a 7.4% decline from the same nine-month period in 2021. Conversely, the number of multifamily permits issued year to date increased 17.8% compared with the first nine months of 2021. The metros with the largest number of single-family permits issued include Houston-The Woodlands-Sugar Land, Dallas-Fort Worth-Arlington, Phoenix-Mesa-Scottsdale, Atlanta-Sandy Springs-Roswell, and Austin-Round Rock. New York-Newark-Jersey City, Dallas-Fort Worth-Arlington, Houston-The Woodlands-Sugar Land, Austin-Round Rock, and Los Angeles-Long Beach-Anaheim issued the largest number of multifamily permits, according to the NAHB.",No Author name,https://www.builderonline.com/data-analysis/single-family-permits-decline-year-to-date-in-september_c,None
HOUSING DEMAND DETERIORATES IN PHOENIX,Housing market conditions in the Phoenix MSA have changed rapidly in the latter half of 2022. An affordability crunch along with growing macroeconomic concerns and inflation levels higher than the national average are resulting in quickly deteriorating demand for homes.,Steven Hensley,https://www.builderonline.com/data-analysis/housing-demand-deteriorates-in-phoenix_o,https://cdnassets.hw.net/dims4/GG/4b190af/2147483647/resize/876x%3E/quality/90/?url=https%3A%2F%2Fcdnassets.hw.net%2Fef%2Fbd%2F8e256cb94964a863eaca33efb2e7%2Fzondapaymentvsincomeratio-phoenix.jpg
PATIOS FUNCTION AS SUBSTITUTES FOR DECKS ON NEW HOMES,"While the share of new homes with patios increased for the sixth year in a row in 2021, the share of homes completed with decks declined for the fifth year in a row to a post-2004 low, according to an NAHB analysis of Survey of Construction (SOC) data. The share of new homes with patios increased to 63%, while the share with decks declined to 17.5%.",No Author name,https://www.builderonline.com/data-analysis/patios-function-as-substitutes-for-decks-on-new-homes_c,None
KITCHEN AND BATH MARKET OUTLOOK WORSENS IN THIRD QUARTER,"The National Kitchen & Bath Association’s (NKBA) Q3 Kitchen & Bath Market Index (KBMI) produced its weakest ratings since the third quarter of 2020. The index gauging future market conditions produced a reading of 55.4 in the third quarter, the lowest level in four years, with the exception of the COVID-impacted first quarter of 2020. The low index readings are consistent with a weaker outlook for the kitchen and bath market and overall macroeconomic headwinds.",Vincent Salandro,https://www.builderonline.com/data-analysis/kitchen-and-bath-market-outlook-worsens-in-third-quarter_o,https://cdnassets.hw.net/dims4/GG/b0bb310/2147483647/resize/300x%3E/quality/90/?url=https%3A%2F%2Fcdnassets.hw.net%2F7b%2F85%2Ff8d58ee449eebf82604086f92d81%2Fscreen-shot-2018-08-28-at-2.46.46%20PM.png
A LOOK AT THE RELATIONSHIP BETWEEN THE 10-YEAR TREASURY AND 30-YEAR MORTGAGE RATE,"The 30-year fixed-rate mortgage moved past 7% in October to reach its highest level in two decades, far above the estimated 4% many economists had expected going into 2022. These higher rates have put substantial pressure on the housing market as the average monthly mortgage payment is now 75% more expensive than at the beginning of the year. The higher rates raise the questions of how did we get here, and where do we go from here?",Ali Wolf,https://www.builderonline.com/data-analysis/a-look-at-the-relationship-between-the-10-year-treasury-and-30-year-mortgage-rate_o,https://cdnassets.hw.net/dims4/GG/b573f93/2147483647/resize/876x%3E/quality/90/?url=https%3A%2F%2Fcdnassets.hw.net%2Fc3%2F95%2F25dbf9cd444da9be231b0ab969ce%2Fhouse-check-up-pulse-graph.jpg
INFLATION GROWS AT SLOWEST PACE SINCE JANUARY,"Consumer prices experienced their smallest year-over-year gain in October since the start of the year, and inflation, while still elevated, experienced the first month below an 8% annual growth rate since February. According to the NAHB, signs that inflation may have peaked and begun to slow may “ease some of the pressure on the Fed to maintain its aggressive monetary policy.”",No Author name,https://www.builderonline.com/data-analysis/inflation-grows-at-slowest-pace-since-january_c,None
"ECONOMIC OUTLOOK: RECESSION, HOUSING DEMAND CONTRACTION, HOME PRICE DECLINES EXPECTED IN 2023","A combination of economic factors, including high inflation and monetary policy tightening, will push the economy into a recession in 2023, according to projections from economists with Zonda, the NAHB, Fannie Mae, and the Mortgage Bankers Association (MBA). Zonda chief economist Ali Wolf says a recession will encompass a broad slowdown across the economy and national job losses. While the technology and real estate industry sectors—particularly lenders—have been most impacted and are slowing more than other sectors of the economy, there are expectations job losses will spread more broadly.",Vincent Salandro,https://www.builderonline.com/data-analysis/economic-outlook-recession-housing-demand-contraction-home-price-declines-expected-in-2023_o,https://cdnassets.hw.net/dims4/GG/b8393ba/2147483647/resize/300x%3E/quality/90/?url=https%3A%2F%2Fcdnassets.hw.net%2F27%2F4a%2Ff311862c4a818355c7dca70159dc%2Fhouse-magnified.jpg
SURVEY: SEARCH FOR AFFORDABLE HOUSING A TOP CONCERN FOR ACTIVE-DUTY SERVICEMEMBERS RETURNING TO CIVILIAN LIFE,"Nearly two-thirds of active-duty servicemembers transitioning to civilian life expect their search for affordable housing to be “extremely” or “somewhat challenging,” according to a survey conducted by Freddie Mac. Other top concerns for transitioning servicemembers are adjusting to a different pace of life and work, and finding a job with similar or greater pay than in the military.",Vincent Salandro,https://www.builderonline.com/data-analysis/survey-search-for-affordable-housing-a-top-concern-for-active-duty-servicemembers-returning-to-civilian-life_o,https://cdnassets.hw.net/dims4/GG/5058704/2147483647/resize/300x%3E/quality/90/?url=https%3A%2F%2Fcdnassets.hw.net%2F92%2F09%2Fb1b89f584d10b23a39bbca0f6587%2Fhousing-starts.jpg
HOUSING AFFORDABILITY FALLS TO LOWEST POINT SINCE GREAT RECESSION,"Rising mortgage rates, inflation, building material supply chain disruptions, and elevated home prices contributed to housing affordability falling to its lowest point since the Great Recession in the third quarter, according to the NAHB/Wells Fargo Housing Opportunity Index (HOI). According to the HOI, just 42.2% of new and existing homes sold in the third quarter were affordable to families earning the U.S. median income of $90,000.",No Author name,https://www.builderonline.com/data-analysis/housing-affordability-falls-to-lowest-point-since-great-recession_o,https://cdnassets.hw.net/dims4/GG/83d011f/2147483647/resize/300x%3E/quality/90/?url=https%3A%2F%2Fcdnassets.hw.net%2F8f%2F29%2Fb0293fe94c33914ab7dfe1b348be%2Fadobestock-250496022-1.jpeg
REPORT: NEW CONSTRUCTION HOUSES ACCOUNT FOR RECORD SHARE OF HOMES FOR SALE IN THIRD QUARTER,"Approximately 29% of U.S. single-family homes for sale in the third quarter were new construction, a record for any historical third quarter, according to a report from Redfin. The share of new construction single-family homes for sale was 25% in the third quarter of 2021 and 18% in the third quarter of 2020. The share of new construction single-family homes for sale is typically seasonal, peaking in the first quarter and before reaching a trough in the second or third quarter.",Vincent Salandro,https://www.builderonline.com/data-analysis/report-new-construction-houses-account-for-record-share-of-homes-for-sale-in-third-quarter_o,https://cdnassets.hw.net/dims4/GG/0ee5d83/2147483647/resize/300x%3E/quality/90/?url=https%3A%2F%2Fcdnassets.hw.net%2F56%2Fcb%2Fa474e7ff40629cbfc7ff25a18ced%2Fproxy-46.jpg
THE TOP 5 U.S. CITIES FOR GEN ZERS,"Homing in on the 100 most populated cities in the U.S., Living Cozy has released its Gen Z City Index for 2022. Measuring 10 factors from median age to job listings to households with internet connection, scores were averaged across the factors to reach a final average score.",No Author name,https://www.builderonline.com/data-analysis/the-top-5-u-s-cities-for-gen-zers_o,https://cdnassets.hw.net/dims4/GG/5422e87/2147483647/resize/876x%3E/quality/90/?url=https%3A%2F%2Fcdnassets.hw.net%2F09%2F07%2Fdf392410456185d7bc009cec3ba6%2Fadobestock-189479952-2.jpeg
REPORT: NUMBER OF HOMES FOR SALE SURPASSES 2020 LEVELS IN OCTOBER,"Active listings increased 33.5% on a year-over-year basis in October to their highest level since 2020, according to the Realtor.com Monthly Housing Trends Report. While the supply of for-home sales has improved, other market factors, including high listing prices, are preventing more shoppers from taking advantage of the rise in available inventory. Affordability continues to price out many would-be home shoppers in October.",Vincent Salandro,https://www.builderonline.com/data-analysis/report-number-of-homes-for-sale-surpasses-2020-levels-in-october_o,https://cdnassets.hw.net/dims4/GG/2793cc9/2147483647/resize/300x%3E/quality/90/?url=https%3A%2F%2Fcdnassets.hw.net%2F20%2F0a%2F3cf2ab68495a9ea8a5b40bba14c1%2Fproxy-13.jpg
SHARE OF YOUNG ADULTS LIVING WITH PARENTS DECLINED IN 2021,"The share of young adults between the ages of 25 and 34 living with parents or parents-in-law declined to 20.2% in 2021, spurred by elevated savings early in the pandemic and encouraged by lower interest rates during the calendar year, according to an NAHB analysis of the 2021 American Community Survey (ACS) Public Use Microdata Sample (PUMS). The age cohort typically accounts for half of all first-time home buyers. As a result, the number and share of young adults in the cohort that choose to live with parents or parents-in-law has a direct impact on household formation, housing demand, and the overall housing market.",No Author name,https://www.builderonline.com/data-analysis/share-of-young-adults-living-with-parents-declined-in-2021_c,None
"NONFARM PAYROLL EMPLOYMENT RISES BY 261,000 IN OCTOBER","Total nonfarm payroll employment increased by 261,000 in October, slightly smaller than the 263,000 jobs added in September, according to the latest jobs report from the Bureau of Labor Statistics (BLS). Monthly job growth has averaged 407,000 through the first 10 months of 2022, compared to 562,000 per month in 2021. Job growth in October was concentrated in service-providing sectors, including education and health services, professional and business services, and leisure and hospitality. The unemployment rate increased 20 basis points month over month to 3.7% in October.",Vincent Salandro,https://www.builderonline.com/data-analysis/nonfarm-payroll-employment-rises-by-261-000-in-october_o,https://cdnassets.hw.net/dims4/GG/9aa33a5/2147483647/resize/300x%3E/quality/90/?url=https%3A%2F%2Fcdnassets.hw.net%2F55%2Fd3%2Fe7bd6502433a8f67a333952ba27c%2Fadobestock-57158359.jpeg
NAHB: MAJORITY OF NEW SINGLE-FAMILY HOMES FEATURE TWO FULL BATHROOMS,"The share of new single-family homes started in 2021 with one full bathroom or less, three full bathrooms, and four full bathrooms or more increased compared to 2020, according to an NAHB analysis of the latest Survey of Construction (SOC). The share of new single-family homes started with two full bathrooms decreased in 2021 compared to 2020.",No Author name,https://www.builderonline.com/data-analysis/nahb-majority-of-new-single-family-homes-feature-two-full-bathrooms_c,None
THE SHARE OF FIRST-TIME HOME BUYERS IS SMALLER AND OLDER,"The share of first-time home buyers has dropped to a record low, according to the National Association of Realtors’ 2022 Profile of Home Buyers and Sellers. Analyzing demographics, preferences, and experiences of buyers and sellers across the U.S., the report reveals that just 26% of buyers between July 2021 and June 2022 were first-time buyers, an all-time low from when NAR began tracking the data in 1981, and down from 34% last year.",Leah Draffen,https://www.builderonline.com/data-analysis/the-share-of-first-time-home-buyers-is-smaller-and-older_o,https://cdnassets.hw.net/dims4/GG/345a8d3/2147483647/resize/876x%3E/quality/90/?url=https%3A%2F%2Fcdnassets.hw.net%2Fff%2F1d%2F0d3e21a0479bb64877eb4609faf7%2Ffamily-home-buyers-kids-adobestock-232824724.jpeg
NEW LOT SUPPLY INVENTORY INCREASES IN THE THIRD QUARTER,"Zonda’s New Home Lot Supply Index (LSI) increased 7.4% on a year-over-year basis to a reading of 41.7 in the third quarter. On a quarter-over-quarter basis, supply increased by 9.7% compared with the second quarter. Despite the increase on both a year-over-year and quarterly basis, the third quarter data reflects a “significantly undersupplied” market nationally, according to Zonda.",Vincent Salandro,https://www.builderonline.com/data-analysis/new-lot-supply-inventory-increases-in-the-third-quarter_o,https://cdnassets.hw.net/dims4/GG/a92522c/2147483647/resize/300x%3E/quality/90/?url=https%3A%2F%2Fcdnassets.hw.net%2F58%2Fe5%2F5bab0d9c448fa33b049a297f4882%2Fadobestock-511654336-1.jpeg
BIDDING WARS ARE THE TOP REASON PROSPECTIVE BUYERS CANNOT MAKE HOME PURCHASES,"Higher interest rates are pricing out many home buyers while also transforming remaining prospects into active buyers, according to the NAHB. Nearly 60% of prospective buyers had moved beyond the planning phase and become fully engaged in the buying process in the third quarter, up significantly from 49% in the second quarter. However, while many prospects are active buyers, the NAHB says 70% of active buyers in the third quarter reported having spent more than three months searching for a home.",No Author name,https://www.builderonline.com/data-analysis/bidding-wars-are-the-top-reason-prospective-buyers-cannot-make-home-purchases_c,None
